Report key,Date and time,Type,Category,Title,Region,Attack on,Coalition forces wounded,Coalition forces killed,Iraq forces wounded,Iraq forces killed,Civilian wia,Civilian kia,Enemy wia,Enemy kia,Enemy detained,Total deaths,Latitude,Longitude
11926,2/2/2004 20:00,Friendly Action,Raid,DOMEIS IPS CONDUCTED A RAID VIC KIRKUK: 1 IPS KIA,MND-N,FRIEND,0,0,0,1,0,0,0,0,0,1,35.41935349,44.39951706
11928,2/2/2004 20:31,Enemy Action,Direct Fire,RPG ATTACK ON 2-503IN PATROL IN KIRKUK: 1 EKIA,MND-N,ENEMY,0,0,0,0,0,0,0,1,0,1,35.45611954,44.39951706
11944,3/2/2004 7:30,Non-Combat Event,Accident,"TRAFFIC ACCIDENT ON 2SQN VIC BASRAH: 1 NEUTRAL KILLED, 3 NEUTRAL INJ",MND-SE,NEUTRAL,0,0,0,0,3,1,0,0,0,1,30.49920082,44.39951706
B48A93F8-7FDF-4779-BF8A-6E08D29C791C,3/2/2004 7:40,Non-Combat Event,Accident,"A big RTA has been reported on route HEXAGON, so far NO CF cas, 14 x IZ cas, 2 x IZ dead, probably 2 x trapped in. 2 Sqn dispatched C/S to control the incident. IRT tasked, ETA 08:07 Route EXAGON west",MND-SE,NEUTRAL,0,0,0,0,14,2,0,0,0,2,30.49920082,44.39951706
11960,3/2/2004 10:20,Friendly Action,Other,BODY OF IZ CIV FOUND VIC MOSUL,MND-N,FRIEND,0,0,0,0,0,1,0,0,0,1,36.33148575,44.39951706
11949,3/2/2004 10:30,Explosive Hazard,IED Explosion,"IED ATK ON 1-32IN ON ASR JACKSON IVO HASWAH: 1 US KIA, 1 US WIA",MND-C,ENEMY,1,1,0,0,0,0,0,0,0,1,32.88763809,44.39951706
11983,3/2/2004 20:30,Enemy Action,Direct Fire,GRENADE ATTK ON FPS IN BAGHDAD: ZONE 37S 1FPS KIA,MND-BAGHDAD,ENEMY,0,0,3,1,0,0,0,0,0,1,33.28524017,44.39951706
11982,3/2/2004 20:54,Enemy Action,Direct Fire,SAF ATTK RPTD BY 3BCT IN BAGHDAD: ZONE 28; 1IZ KIA,MND-BAGHDAD,ENEMY,0,0,0,0,0,0,1,1,1,1,33.36885834,44.39951706
12035,4/2/2004 8:00,Enemy Action,Direct Fire,ATTK ON ICDC (1-68AR) SOLDIER VIC TARMIYAH: 1X ICDC KIA,MND-BAGHDAD,ENEMY,0,0,0,1,0,0,0,0,0,1,33.6678009,44.39951706
12027,4/2/2004 9:00,Non-Combat Event,Accident,"VEH ACCIDENT WITH TF RIE VIC BAYJI: 1 NEUTRAL KILLED, 2 NEUTRAL WOUNDED",MND-N,NEUTRAL,0,0,0,0,2,1,0,0,0,1,35.00774002,44.39951706
6F891540-797C-4515-AE95-1442BB31E7BA,4/2/2004 13:10,Criminal Event,Theft,"A car hijack on a civilian contractor, took place at route Haxagon. A green Pajero is ambushed by 3 vehicles a shooting took place. A BECHTEL C/S took 4 casualties to APOD medcentre and 2 sqn is inves",MND-SE,ENEMY,0,0,0,0,4,1,0,0,0,1,30.49592972,44.39951706
12104,5/2/2004 14:14,Enemy Action,Indirect Fire,"MORTAR ATK ON LOG BASE SEITZ IN BAGHDAD (ZONE 6S): 1 CF KIA, 1 CF WIA",MND-BAGHDAD,ENEMY,1,1,0,0,0,0,0,0,0,1,33.28891373,44.39951706
12136,5/2/2004 15:30,Explosive Hazard,Mine Found/Cleared,CACHE FOUND BY 1BCT VIC AL HILLAH: EOD ON SITE,MND-C,ENEMY,0,0,0,0,0,1,0,0,0,1,32.40026093,44.39951706
12140,5/2/2004 20:05,Enemy Action,Direct Fire,"DRIVE BY SHOOTING ON FPS VIC MAHMUDIYAH: 2 FPS KIA, 1 FPS WIA",MND-C,ENEMY,0,0,1,2,0,0,0,0,0,2,33.1297226,44.39951706
12184,6/2/2004 12:17,Enemy Action,Indirect Fire,"RKT FIRED IVO LSA ANACONDA; 1-10CAV CONDUCTED SEARCH: 1 EKIA, 1 EWIA",MND-N,ENEMY,0,0,0,0,0,0,1,1,0,1,33.96237183,44.39951706
12228,6/2/2004 14:30,Non-Combat Event,Accident,CHILD STRUCK BY VEHICLE ON MSR TAMPA VIC AL MADHATIYAH: 1 NEUTRAL KILLED,MND-C,NEUTRAL,0,0,0,0,0,1,0,0,0,1,32.36275864,44.39951706
12236,6/2/2004 18:00,Non-Combat Event,Accident,"STRYKER ACCIDENT INVOLVING CIVILIANS IN MOSUL: 1 NEUTRAL KILLED, 1 NEUTRAL WOUND",MND-N,NEUTRAL,0,0,0,0,1,1,0,0,0,1,36.35025406,44.39951706
12222,6/2/2004 21:55,Enemy Action,Direct Fire,RPG ATK ON 1-34AR PATROL VIC KHALIDIYAH: 1 EKIA,MNF-W,ENEMY,0,0,0,0,0,0,0,1,0,1,33.40041733,44.39951706
12277,6/2/2004 22:30,Friendly Action,Detain,AERIAL PATROL ENGAGES 2 ARMED IZ VIC ABAYACHI: 1 X EN KIA,MND-N,FRIEND,0,0,0,0,0,0,0,1,0,1,33.7592659,44.39951706
12250,7/2/2004 9:20,Explosive Hazard,IED Explosion,"EXPLOSION IN AS SUWAYRAH IPS OFFICE: 3 IPS WIA; 3 NEUTRAL KILLED, 5 NEUTRAL WOUN",MND-C,ENEMY,0,0,3,0,5,3,0,0,0,3,32.48999405,44.39951706
12269,7/2/2004 9:20,Friendly Action,Other,"ESCAPE ATTEMPT IN AN NASIRYAH IPS STATION: 2 EKIA, 7 EWIA",MND-SE,FRIEND,0,0,0,0,0,0,7,2,0,2,31.03378105,44.39951706
D879A408-2BB6-40A9-B8B1-0EED335C2393,7/2/2004 12:25,Other,Other,"About this morning escape attempt, prisoners have been captured . At 12:25 IZP reported prisoners casualties: 2 dead and 7 wounded. The prisoners were armed with one hand grenade and IZP fired for sel",MND-SE,NEUTRAL,0,0,0,0,7,2,0,0,0,2,31.03378105,44.39951706
12293,7/2/2004 21:58,Enemy Action,Direct Fire,"SAF ATK ON 1-22IN SNIPER TM VIC CADASEEYAH: 1 EKIA, 2 EWIA",MND-N,ENEMY,0,0,0,0,0,0,2,1,0,1,34.62681198,44.39951706
12342,8/2/2004 16:46,Explosive Hazard,IED Explosion,IED DETONATES WHILE BEING DISARMED S. OF MAHMUDIYAH: 1 CF KIA,MND-C,ENEMY,0,1,0,0,0,0,0,0,0,1,33.00930405,44.39951706
12348,8/2/2004 19:45,Enemy Action,Indirect Fire,"ROCKET ATTK IN BAGHDAD (ZONE 4): 1 CF WIA; 1 NEU KILLED, 1 NEU INJ; 2 DETAINED",MND-BAGHDAD,ENEMY,1,0,0,0,1,1,0,0,2,1,33.27014923,44.39951706
12395,9/2/2004 12:40,Non-Combat Event,Accident,ACCIDENTAL UXO EXPLOSION IVO SINJAR: 2 US KIA,MND-N,NEUTRAL,5,2,0,0,0,0,0,0,0,2,36.28212357,44.39951706
12402,9/2/2004 13:06,Friendly Action,Other,REMAINS OF IPS OFFICER FOUND BY NAVY DIVERS IN MOSUL: 1 IPS KIA,MND-N,FRIEND,0,0,0,1,0,0,0,0,0,1,36.3589325,44.39951706
12437,9/2/2004 17:45,Enemy Action,Direct Fire,"SAF ATTK ON FPS VIC ISKANDARIYAH: 2 FPS KIA, 1 FPS WIA, 1 NEUT KIA",MND-C,ENEMY,0,0,1,2,0,1,0,0,0,3,32.95245743,44.39951706
12427,9/2/2004 18:57,Enemy Action,Attack,INDIRECT FIRE ATTK ON 1/3ACR BCP VIC HUSAYBAH: 2 EKIA,MNF-W,ENEMY,0,0,0,0,0,0,0,2,0,2,34.39648819,44.39951706
12434,9/2/2004 21:19,Friendly Action,Attack,"2-8IN PATROL ENGAGES ENEMY DISMOUNTS CARRYING RPGS, AK47S AND NIGHT VISION EQUIP",MND-N,FRIEND,0,0,0,0,0,0,0,10,0,10,33.99948883,44.39951706
12431,9/2/2004 21:31,Explosive Hazard,IED Explosion,"SUICIDE BOMBER ATTKS CIVILIANS VIC AR RAMADI: 1 EKIA, 5 NEU INJ",MNF-W,ENEMY,0,0,0,0,5,0,0,1,0,1,33.4250145,44.39951706
12457,10/2/2004 7:00,Enemy Action,Direct Fire,"IPS OFFICER KILLED IN DRIVE BY SHOOTING IN MOSUL: 1 IPS KIA, 2 IPS WIA",MND-N,ENEMY,0,0,2,1,0,0,0,0,0,1,36.3302803,44.39951706
12463,10/2/2004 8:15,Enemy Action,Direct Fire,SAF ATTKS ON IPS IN BAGHDAD (ZONE 27): 3 IPS KIA,MND-BAGHDAD,ENEMY,0,0,0,3,0,0,0,0,0,3,33.36532974,44.39951706
12453,10/2/2004 9:12,Explosive Hazard,IED Explosion,"VBIED EXPLOSION AT THE ISKANDARIYAH POLICE STATION: 35 NEUT KILLED, 75 NEUT INJ",MND-C,ENEMY,0,0,0,0,75,35,0,0,0,35,32.87414169,44.39951706
12521,10/2/2004 10:00,Friendly Action,Other,MISSING US SOLDIER RECOVERED FROM CAPSIZED BOAT IN MOSUL ON 25 JAN 04,MND-N,FRIEND,0,1,0,0,0,0,0,0,0,1,36.351017,44.39951706
12544,11/2/2004 7:35,Explosive Hazard,IED Explosion,VBIED ATTK ON NIA RECRUITING STATION IN BAGHDAD (ZONE 8S): 3 CF WIA; 47 NEUT KIL,MND-BAGHDAD,ENEMY,3,0,0,0,55,47,0,0,0,47,33.32355881,44.39951706
12711,11/2/2004 9:00,Enemy Action,Direct Fire,SAF ATTK ON IPS IN AR RAMADI,MNF-W,ENEMY,0,0,0,1,0,0,0,0,0,1,33.4250145,44.39951706
12562,11/2/2004 9:45,Non-Combat Event,Accident,"TRAFFIC ACCIDENT WITH CIV VEH VIC SAMAWAH: 1 CF INJ; 1 IZ KILLED, 3 IZ WOUNDED",MND-SE,NEUTRAL,1,0,0,0,3,1,0,0,0,1,31.26226425,44.39951706
ABAE6BE5-CB9B-4A0A-9643-459ED316EDD3,11/2/2004 9:45,Non-Combat Event,Accident,An armored white fleet vehicle had a frontal crash with an IZ vehicle coming fm the opposite direction. This accident was caused by a dangerous IZ overtaking move. This accident was fatal to 1 IZ pers,MND-SE,NEUTRAL,0,0,0,0,2,1,0,0,0,1,31.26226425,44.39951706
12583,11/2/2004 18:29,Enemy Action,Direct Fire,"SAF ATTK ON IPS VIC AR RAMADI: 2 IPS KIA, 1 IPS WIA",MNF-W,ENEMY,0,0,1,2,0,0,0,0,0,2,33.41498947,44.39951706
12629,11/2/2004 18:40,Enemy Action,Direct Fire,SAF ATTK ON IPS IN MOSUL: 1 ISP KILLED; 4 ISP INJURED,MND-N,ENEMY,0,0,4,1,0,0,0,0,0,1,36.37447739,44.39951706
12579,11/2/2004 22:00,Explosive Hazard,IED Explosion,IED ATTK ON 1-4ADA IN BAGHDAD (ZONE 60): 2 US KIA; 1 US WIA,MND-BAGHDAD,ENEMY,1,2,0,0,0,0,0,0,0,2,33.28385544,44.39951706
12640,12/2/2004 8:00,Non-Combat Event,Accident,UK SM ACCIDENTAL DEATH VIC BASRAH,MND-SE,NEUTRAL,0,1,0,0,0,0,0,0,0,1,30.41008377,44.39951706
12617,12/2/2004 9:44,Friendly Action,Patrol,DETAINEE SHOT ATTEMPTING TO FLEE VIC TAJI: 1 IZ KIA,MND-BAGHDAD,FRIEND,0,0,0,0,0,0,0,1,0,1,33.5055809,44.39951706
12641,12/2/2004 14:00,Non-Combat Event,Accident,"TRAFFIC ACCIDENT RPTD BY 17FA VIC JALABAH: 3 CF INJ, 1 TCN KILLED",MND-SE,NEUTRAL,3,0,0,0,0,1,0,0,0,1,30.65506172,44.39951706
12682,12/2/2004 20:00,Enemy Action,Direct Fire,IZ SPECIAL INVESTAGATION TEAM MEMBER KIA,MND-N,ENEMY,0,0,0,1,0,0,0,0,0,1,36.35969543,44.39951706
12672,12/2/2004 22:20,Enemy Action,Attack,"SAF ATTK ON IPS TCP IVO KIRKUK: 1 EKIA, 1 EWIA, 1 DETAINED",MND-N,ENEMY,0,0,0,0,0,0,1,1,1,1,35.46966171,44.39951706
12655,12/2/2004 22:40,Explosive Hazard,IED Explosion,"IED,RPG,SAF ATTK ON 670MP PATROL VIC ABU GHARYB: 1 US KIA; 2 US WIA",MND-C,ENEMY,2,1,0,0,0,0,0,0,0,1,33.24370193,44.39951706
12670,13/02/2004 02:47,Non-Combat Event,Accident,VEHICLE ACCIDENT INVOLVING M2 PATROL AND CIVILIAN VEHICLE IVO WEST TIKRIT; 2X NE,MND-N,NEUTRAL,0,0,0,0,0,2,0,0,0,2,34.59128571,44.39951706
12685,13/02/2004 07:00,Criminal Event,Murder,DEAD NEUT BODY FOUND BY 1-124IN IVO AR RAMADI,MNF-W,ENEMY,0,0,0,0,0,1,0,0,0,1,33.4235878,44.39951706
12741,13/02/2004 17:20,Friendly Action,Other,SOLDIER'S REMAIN RECOVERED BY SBCT,MND-N,FRIEND,0,1,0,0,0,0,0,0,0,1,36.32717133,44.39951706
12758,13/02/2004 20:15,Friendly Action,Other,"EXPLOSION AT CEA DEPOT (TALLIL): 1 NEUT KILLED, 3 NEUT INJURED",MND-SE,FRIEND,0,0,0,0,3,1,0,0,0,1,30.95329857,44.39951706
6DC04D42-EA54-40A0-9611-CD1578261766,13/02/2004 20:15,Non-Combat Event,Accident,Some explosions took place in the CEA Depot 1 x IZ died and 3x IZs were wounded. They probably were trying to steal some ammunition. The IZs wounded were handed to the Civilian Hospital in An Nasiriya,MND-SE,NEUTRAL,0,0,0,0,3,1,0,0,0,1,30.95329857,44.39951706
12753,13/02/2004 22:30,Non-Combat Event,Accident,"VEHICLE ACCIDENT INVOLVING 2-504PIR SOUTH OF BAGHDAD: 1 CF KIA, 1 CF WIA",MND-C,NEUTRAL,1,1,0,0,0,0,0,0,0,1,33.14472198,44.39951706
12754,14/02/2004 01:16,Explosive Hazard,IED Explosion,"ICDC HQ ATTKD WITH IED N OF JALULA, 1X ICDC, 1X INTERPRETER KIA, 4X ICDC INJURED",MND-N,ENEMY,0,0,4,1,0,1,0,0,0,2,34.32406235,44.39951706
12771,14/02/2004 08:15,Enemy Action,Direct Fire,"COORD ATTK ON NISF IN FALLUJAH: 23 IPS KIA, 30 IPS WIA, 4 EN KIA, 3 EN WIA",MNF-W,ENEMY,0,0,30,23,0,0,3,4,1,27,33.35313797,44.39951706
12788,14/02/2004 15:43,Enemy Action,Direct Fire,"US CIVILIANS AMBUSHED VIC MAHMUDIYAH: 1 NEU KILLED, 3 NEU INJ",MND-C,ENEMY,0,0,0,0,3,1,0,0,0,1,33.05981064,44.39951706
12802,14/02/2004 17:55,Enemy Action,Direct Fire,SAF ATTK ON IPS VIC TARMIYAH: 3 IPS KIA,MND-BAGHDAD,ENEMY,0,0,0,3,0,0,0,0,0,3,33.65045547,44.39951706
12792,14/02/2004 18:28,Non-Combat Event,Accident,CIV VEH HITS MIL VEH IN BAGHDAD (ZONE 14E): 4X IZ KILLED,MND-BAGHDAD,NEUTRAL,0,0,0,0,4,4,0,0,0,4,33.30565262,44.39951706
12857,15/02/2004 19:15,Enemy Action,Direct Fire,"IZ WOUNDED LOCATED BY 20BDE IN BASRAH CITY:  8 NEUT KILLED, 3 NEUT WOUNDED",MND-S,ENEMY,0,0,0,0,5,3,0,0,1,3,30.50031662,44.39951706
E3A8B70E-CD9B-42E1-87DD-B3E6CFF2E662,15/02/2004 19:15,Enemy Action,Direct Fire,C/S from A Coy RRW and IPS patrol as part of Op MIAMI 2 came across the scene of a shooting incident at R8. Found 3 dead IZ and 5 injured IZ of which 3 seriously. They were distributed as follows - Ge,MND-S,ENEMY,0,0,0,0,5,3,0,0,0,3,30.50031662,44.39951706
12866,15/02/2004 20:14,Enemy Action,Direct Fire,"SAF ATTK ON 2-8IN VIC MUQDADIYAH: 1 EKIA, 2X DETAINED",MND-N,ENEMY,0,0,0,0,0,0,0,1,2,1,33.97513199,44.39951706
12876,15/02/2004 20:37,Friendly Action,Attack,"PATROL FROM 2-505PIR REACTS TO SUSPICIOUS ACTIVITY IVO AL MUSSAYYIB: 1 EKIA, 3 D",MND-C,FRIEND,0,0,0,0,0,0,0,1,3,1,32.80495834,44.39951706
12867,15/02/2004 20:46,Friendly Action,Confiscation,SUSPICIOUS ACTIVITY RPTD BY 2BCT VIC BAQUBAH; 1X EN W/MTR BASEPLATES KIA,MND-N,FRIEND,0,0,0,0,0,0,0,1,0,1,33.76990128,44.39951706
12879,15/02/2004 21:33,Enemy Action,Direct Fire,SAF ATK ON 1-16IN ON THE EUPHRATES NORTH OF AR RAMADI: 2 EN KIA,MNF-W,ENEMY,0,0,0,0,0,0,0,2,0,2,33.4703064,44.39951706
12905,16/02/2004 01:00,Friendly Action,Cordon/Search,"CORDON/SEARCH S. OF FALLUJAH: 9 DETAINED, 4 CF WIA, 1 EN KIA",MNF-W,FRIEND,4,0,0,0,0,0,0,1,9,1,33.18466949,44.39951706
12920,16/02/2004 09:30,Explosive Hazard,IED Explosion,EXPLOSION RPTD BY 3BCT VIC SAMARRA,MND-N,ENEMY,0,0,0,0,0,3,0,0,0,3,34.18368912,44.39951706
12906,16/02/2004 09:30,Non-Combat Event,Accident,MIL/CIV VEH ACCIDENT S. OF HADITHA: 2 NEU KILLED,MNF-W,NEUTRAL,0,0,0,0,0,2,0,0,0,2,34.02181244,44.39951706
12892,16/02/2004 09:30,Explosive Hazard,IED Explosion,"IED ATTK ON 1165MP(89MPS)IN BAGHDAD: 1 X CF KIA, 1 X CF WIA",MND-BAGHDAD,ENEMY,1,1,0,0,0,0,0,0,0,1,33.22226715,44.39951706
12899,16/02/2004 09:55,Explosive Hazard,IED Explosion,"IED ATTK ON 415CA CONVOY IVO BAQUBAH: 1 CF KIA, 4 CF WIA",MND-N,ENEMY,4,1,0,0,0,0,0,0,2,1,33.75805283,44.39951706
12927,16/02/2004 11:00,Non-Combat Event,Accident,MIL/CIV VEH ACCIDENT WITH 225FSB VIC AL OUJA: 1 IZ KILLED,MND-N,NEUTRAL,0,0,0,0,0,1,0,0,0,1,34.52913284,44.39951706
12928,16/02/2004 16:35,Enemy Action,Direct Fire,SAF THREAT ON 2/2ACR IN ZONE 21: 1X IZ KIA 1X IZ WIA,MND-BAGHDAD,ENEMY,0,0,0,0,0,0,1,1,1,1,33.36601639,44.39951706
13027,16/02/2004 16:37,Enemy Action,Direct Fire,US CIV SHOT VIC ZONE 37N: 1X US NEU KILLED,MND-BAGHDAD,ENEMY,0,0,0,0,0,1,0,0,0,1,33.30677414,44.39951706
12929,16/02/2004 17:15,Explosive Hazard,IED Explosion,"IED ATTK ON 1-14CAV CONVOY VIC TAL AFAR: 1 CF KIA, 1 CF WIA",MND-N,ENEMY,1,1,0,0,0,0,0,0,0,1,36.3858223,44.39951706
13045,17/02/2004 15:42,Friendly Action,Other offensive,IZ CIV KILLED BY US H+I MORTAR FIRES VIC TIKRIT,MND-N,FRIEND,0,0,0,0,0,3,0,0,0,3,34.62353897,44.39951706
13046,17/02/2004 22:00,Criminal Event,Theft,2X IZ KILLED IN CIVILIAN VEHICLE THEFT IVO KARBALA: 2 NEUT KILLED,MND-C,ENEMY,0,0,0,0,0,2,0,0,0,2,32.63269806,44.39951706
13069,18/02/2004 07:15,Explosive Hazard,IED Explosion,VBIED ATTK ON MND(CS) COMPOUND IVO HILLAH: 58 CF WIA,MND-S,ENEMY,58,0,0,0,32,8,0,2,0,10,32.50001907,44.39951706
13075,18/02/2004 07:15,Friendly Action,Cordon/Search,"CORDON AND SEARCH CONDUCTED BY C/1-8IN IVO BALAD: 1 EKIA, 1 DETAINED",MND-N,FRIEND,0,0,0,0,0,0,0,1,1,1,34.01753998,44.39951706
13109,18/02/2004 13:45,Enemy Action,Direct Fire,SAF ATTK ON IPS IN BAGHDAD (ZONE 45):,MND-BAGHDAD,ENEMY,0,0,1,1,0,0,0,0,0,1,33.35593796,44.39951706
13105,18/02/2004 16:15,Enemy Action,Direct Fire,RPG ATTK ON 1-22IN PATROL VIC TIKRIT: 1 IZ NEU KILLED,MND-N,ENEMY,0,0,0,0,0,1,0,0,0,1,34.58944321,44.39951706
13113,18/02/2004 18:50,Enemy Action,Indirect Fire,INDIRECT ATTK ON BCCF VIC ABU GHARYIB:1 CF WIA (RTD),MND-BAGHDAD,ENEMY,1,0,0,0,0,0,0,1,7,1,33.29104233,44.39951706
13133,18/02/2004 22:32,Friendly Action,Attack,PATROL STOPS POSSIBLE CRIMINALS: 3 X EKIA,MND-BAGHDAD,FRIEND,0,0,0,0,1,1,0,3,0,4,33.26100922,44.39951706
13149,19/02/2004 10:26,Explosive Hazard,IED Explosion,IED/SAF ATTK ON 1-34AR PATROL IVO KHALIDIYAH,MNF-W,ENEMY,1,2,0,1,0,1,0,0,0,4,33.395401,44.39951706
13150,19/02/2004 11:20,Enemy Action,Direct Fire,"ATTK ON HADITHAH AND HAQLANIYAH IPS STATIONS; 2 IPS KIA, 1 CF WIA, 1 IPS WIA",MNF-W,ENEMY,1,0,1,2,0,0,1,1,0,3,34.13206482,44.39951706
13168,19/02/2004 13:05,Enemy Action,Direct Fire,"SAF ATTK ON TF1-16 E. OF RAMADI; 1X CF WIA, 1 EN KIA",MNF-W,ENEMY,1,0,0,0,0,0,0,1,0,1,33.46035385,44.39951706
13169,19/02/2004 15:00,Enemy Action,Direct Fire,SAF ATTK ON IPS VIC AL FALLUJAH: 1 IPS KIA,MNF-W,ENEMY,0,0,0,1,0,0,0,0,0,1,33.40307236,44.39951706
13197,19/02/2004 19:25,Friendly Action,Other,DETAINEE DIES OF NATURAL CAUSES AT BCCF (BAGHDAD): 1 NEUT DEAD,MND-BAGHDAD,FRIEND,0,0,0,0,0,1,0,0,0,1,33.28975296,44.39951706
13224,20/02/2004 09:50,Non-Combat Event,Accident,SOLDIER KILLED IN MIL VEH ACCIDENT IVO AD DUJAYL: 1 CF KIA,MND-N,NEUTRAL,0,1,0,0,0,0,0,0,0,1,33.77217865,44.39951706
13251,20/02/2004 14:00,Enemy Action,Direct Fire,"SAF ATTK ON IPS TCP VIC ISKANDARIYAH: 1X IPS KIA, 1X IPS WIA",MND-C,ENEMY,0,0,1,1,0,0,0,0,0,1,32.88259888,44.39951706
13311,20/02/2004 23:00,Enemy Action,Attack,ICDC BN COMD ASSASSINATED IVO DIWANIYAH: 1X ISF KIA,MND-C,ENEMY,0,0,0,1,0,0,0,0,0,1,32.00867081,44.39951706
13271,21/02/2004 00:20,Friendly Action,Attack,MP TCP ENGAGES VEHICLE IN BAGHDAD: 1X NEUT KILLED,MND-BAGHDAD,FRIEND,0,0,0,0,0,0,0,1,0,1,33.35414886,44.39951706
13318,21/02/2004 09:30,Enemy Action,Direct Fire,"CA CONVOY AMBUSHED IVO ISKANDARIYAH: 4 CF WIA, 1 NEUT KIA",MND-C,ENEMY,4,0,0,0,0,1,0,0,0,1,32.93533707,44.39951706
13498,21/02/2004 09:30,Enemy Action,Direct Fire,USACE CONTRACTOR CONVOY ATTACKED IVO ABU GHARYIB: 1 NEU KILLED,MND-BAGHDAD,ENEMY,0,0,0,0,1,1,0,0,0,1,33.31194687,44.39951706
13416,21/02/2004 16:00,Enemy Action,Direct Fire,SAF ATTK ON IPS CHIEF IN MOSUL: 1 EKIA,MND-N,ENEMY,0,0,0,0,0,0,0,1,0,1,36.34959412,44.39951706
13372,21/02/2004 19:40,Enemy Action,Direct Fire,"SAF ATTK ON ICDC TCP: 1 ICDC WIA, 1 EN KIA",MND-N,ENEMY,0,0,1,0,0,0,0,1,0,1,34.05895996,44.39951706
13422,22/02/2004 03:00,Friendly Action,Raid,RAID CONDUCTED BY USSF ON ACF IVO BAGHDAD: 1 EKIA; 12 DETAINED,MND-BAGHDAD,FRIEND,0,0,0,0,0,0,0,1,12,1,33.35727692,44.39951706
13452,22/02/2004 11:00,Explosive Hazard,IED Explosion,IED EXPLODED IN MOSUL: 1 NEU KILLED,MND-N,ENEMY,0,0,0,0,0,1,0,0,0,1,36.35243988,44.39951706
13445,22/02/2004 19:15,Enemy Action,Attack,ATTK ON KDP HQ IVO MOSUL: 2X EKIA,MND-N,ENEMY,0,0,0,0,0,0,0,2,0,2,36.35411835,44.39951706
13443,22/02/2004 19:59,Enemy Action,Indirect Fire,"RPG AND IED ATTACK IN VIC BAQUBAH CMOC RPTD BY 2BCT: 4 NEU KIA, 4 NEU WIA, 4X IZ",MND-N,ENEMY,0,0,0,0,4,4,0,0,4,4,33.74014664,44.39951706
13453,22/02/2004 21:05,Enemy Action,Indirect Fire,INDIRECT FIRE ATTK IN ZONE 18: 2 NEU KILLED,MND-BAGHDAD,ENEMY,0,0,0,0,0,2,0,0,0,2,33.36829376,44.39951706
13474,23/02/2004 08:15,Explosive Hazard,IED Explosion,"VBIED ATTK ON IPS IVO KIRKUK: 8 IPS KIA, 33 IPS  WOUNDED",MND-N,ENEMY,0,0,33,8,2,0,0,0,0,8,35.48321915,44.39951706
13481,23/02/2004 08:50,Enemy Action,Direct Fire,ASSASINATION OF ICDC SOLDIER IN SAMARRA: 1 ICDC KILLED,MND-N,ENEMY,0,0,0,1,0,0,0,0,0,1,34.20101929,44.39951706
13472,23/02/2004 09:55,Friendly Action,Attack,"DAMAGED CIVILIAN VEHICLE FOUND IN MOSUL: 2 NEU DEAD, 3 NEU WOUNDED",MND-N,FRIEND,0,0,0,0,3,2,0,0,0,2,36.34143829,44.39951706
13499,23/02/2004 13:20,Explosive Hazard,IED Explosion,IED ATTK ON CONVOY IVO ISKANDARIYAH: 1 NEU KILLED; 2 NEU INJ,MND-C,ENEMY,0,0,0,0,2,1,0,0,0,1,32.88939667,44.39951706
13587,23/02/2004 15:30,Enemy Action,Attack,ATTK ON IPS OFFICER IVO MOSUL: 1 IPS KIA,MND-N,ENEMY,0,0,0,1,0,0,0,0,0,1,36.35057449,44.39951706
13530,23/02/2004 16:00,Enemy Action,Direct Fire,SAF ATTK ON FPS IN MOSUL: 1 NEU KILLED,MND-N,ENEMY,0,0,0,0,0,1,0,0,0,1,36.35257339,44.39951706
6F7F18A7-373D-4DCA-A8A2-FD277EB71AEA,24/02/2004 11:00,Criminal Event,Murder,An IZ male was delivered at the combined IP/ICDC/ CF location at As Salman This person was found dead 1 Km north of the As Salman fuel station along ASR Milwaukee. This IZ male was killed by a knife;,MND-SE,ENEMY,0,0,0,0,0,1,0,0,0,1,30.51009178,44.39951706
13629,24/02/2004 13:30,Non-Combat Event,Accident,CONVOY ACCIDENTALLY KILLS IZ CHILD: 1 NEUT DEAD,,NEUTRAL,0,0,0,0,0,1,0,0,0,1,31.99540329,44.39951706
13592,24/02/2004 16:00,Enemy Action,Direct Fire,SAF ATTK ON TITAN CONTRACTOR IVO AL FALLUJAH: 1 NEU KILLED,MNF-W,ENEMY,0,0,0,0,0,1,0,0,7,1,33.3384819,44.39951706
13604,24/02/2004 20:00,Enemy Action,Direct Fire,SAF ATTK ON ALLEGED BA'ATH PARTY MEMBER IN MOSUL: 1 IZ KILLED; 1 IZ INJ,MND-N,ENEMY,0,0,0,0,1,1,0,0,0,1,36.34969711,44.39951706
13618,24/02/2004 22:00,Enemy Action,Direct Fire,"SAF ATTK ON ICDC SOLDIERS IVO AL FALLUJAH: 1 ISF KIA, 1 ISF WIA",MNF-W,ENEMY,0,0,1,1,0,0,0,0,0,1,33.35498428,44.39951706
13637,25/02/2004 09:05,Enemy Action,Direct Fire,SAF ATTK ON ISP OFFICER IVO MOSUL: 1 IPS KIA,MND-N,ENEMY,0,0,0,1,0,0,0,0,0,1,36.31235886,44.39951706
13645,25/02/2004 13:58,Non-Combat Event,Accident,3ACR OH-58 DOWN IN HADITHA: 2X US KIA,MNF-W,NEUTRAL,0,2,0,0,0,0,0,0,0,2,34.15388107,44.39951706
13669,25/02/2004 19:50,Friendly Action,Attack,1-504 TCP ENGAGES CIV VEH IVO AL FALLUJAH: 1X NEU KIA,MND-BAGHDAD,FRIEND,0,0,0,0,0,1,0,0,0,1,33.40009689,44.39951706
13724,26/02/2004 13:58,Explosive Hazard,IED Explosion,ATTK ON IPS OFFICER IN BAQUBAH: 1 IPS KIA; 2 IPS WIA,MND-N,ENEMY,0,0,2,1,0,0,0,0,0,1,33.75094604,44.39951706
13847,27/02/2004 19:45,Enemy Action,Direct Fire,"SAF ATTK ON IPS TCP IVO MOSUL: 2 EKIA, 2 DETAINED",MND-N,ENEMY,0,0,0,0,0,0,0,2,2,2,36.30540085,44.39951706
13831,27/02/2004 22:30,Enemy Action,Direct Fire,SAF ATTK ON ALMAS IPS STATION IN KIRKUK; 1 IPS KIA,MND-N,ENEMY,0,0,0,1,0,0,0,0,0,1,35.47866058,44.39951706
13848,28/02/2004 02:04,Friendly Action,Cordon/Search,"CORDON AND SEARCH BY 2-505 IVO BABYLON: 1 EKIA, 3 DETAINED",MND-C,FRIEND,0,0,0,0,0,0,0,1,3,1,32.76133347,44.39951706
13921,28/02/2004 09:05,Friendly Action,Cordon/Search,CORDON AND SEARCH BY A/1-27IN EAST OF TAAL AL JAL: 1 IZ KILLED,MND-N,FRIEND,0,0,0,0,0,1,0,0,0,1,35.32723618,44.39951706
13860,28/02/2004 09:15,Friendly Action,Attack,"VEHICLE ATTEMPTS TO EVADE ICDC TCP IVO BAQUBAH:  1 EKIA, 4 DETAINED",MND-N,FRIEND,0,0,0,0,0,0,0,1,4,1,33.68742371,44.39951706
13911,28/02/2004 14:50,Explosive Hazard,IED Explosion,IED ATTK ON IPS IN BAGHDAD (ZONE 25): 1 IPS KIA; 1 IPS WIA,MND-BAGHDAD,ENEMY,0,0,1,1,0,0,0,0,0,1,33.24578094,44.39951706
13914,28/02/2004 21:00,Explosive Hazard,IED Explosion,IED ATTK ON 2-12CAV IN BAGHDAD (ZONE 6N): 1 CF KIA (ESTONIAN),MND-BAGHDAD,ENEMY,0,1,0,0,0,0,0,0,1,1,33.30137253,44.39951706
C142B069-E460-4B80-9396-EFFDD3FD974F,28/02/2004 22:30,Friendly Action,Escalation of Force,"ESCALATION OF FORCE BY 2-504 IN BAGHDAD(ZONE 25): 1 CIV KILLED, 1 CIV INJ, 0 CF INJ/DAMAGE",MND-BAGHDAD,FRIEND,0,0,0,0,1,1,0,0,0,1,33.24560928,44.39951706
8D3D5160-C149-4B38-BDF2-F9AB01F584A5,29/02/2004 09:50,Friendly Action,Escalation of Force,"Shooting incident between an US convoy and local Izs South RUMAYTHA. Preliminary reports indicate 1 EWIA. QRF, MP and patrols were deployed from Ar Rumaytha to investigate and report. Final report sta",MND-SE,FRIEND,0,0,0,0,1,1,0,0,0,1,31.51547432,44.39951706
13962,29/02/2004 10:00,Friendly Action,Other,US CONVOY ENGAGES IZ VEH IVO RUMAYTHA: 2IZ KILLED,MND-SE,FRIEND,0,0,0,0,0,2,0,0,0,2,31.51547432,44.39951706
13953,29/02/2004 14:25,Enemy Action,Direct Fire,"RPG AND SAF ATTK ON 1/3ACR PATROL IVO HUSAYBAH: 1X EKIA, 2X EWIA",MNF-W,ENEMY,0,0,0,0,0,0,2,1,1,1,34.38444901,44.39951706
14002,29/02/2004 15:30,Non-Combat Event,Accident,VEHICLE ACCIDENT (KBR) SOUTH OF DIWANYAH: 1 NEUT KILLED,MND-SE,NEUTRAL,0,0,0,0,0,1,0,0,0,1,31.72660828,44.39951706
13989,29/02/2004 22:10,criminal event,murder,IZ WAS SHOT AND KILLED NEAR FOB MAREZ IN MOSUL,MND-N,ENEMY,0,0,0,0,0,1,0,0,0,1,36.29822922,44.39951706
14037,1/3/2004 12:45,Enemy Action,Direct Fire,"SAF ATTK ON IPS TCP SOUTH OF ISKANDARIYAH: 1 EKIA, 2 EWIA",MND-C,ENEMY,0,0,0,0,0,0,2,1,0,1,32.87365341,44.39951706
14179,1/3/2004 20:00,Explosive Hazard,IED Explosion,SABOTAGE OF THE TALL AFAR CEMENT PLANT: 1 EKIA,MND-N,ENEMY,0,0,0,0,0,0,0,1,0,1,36.36715698,44.39951706
14087,1/3/2004 20:04,Explosive Hazard,IED Explosion,EXPLOSIONS REPORTED BY 1-14CAV IN TALL AFAR: 1 NEUT KILLED,MND-N,ENEMY,0,0,0,0,0,1,0,0,0,1,36.36715698,44.39951706
14151,2/3/2004 0:00,Explosive Hazard,IED Explosion,"IED EXPLOSION IN AR RAMADI: 1X NKIA, 2X NWIA",MNF-W,ENEMY,0,0,0,0,2,1,0,0,0,1,33.43493271,44.39951706
14114,2/3/2004 10:00,Friendly Action,Attack,"EXPLOSIONS IN SHRINE IN BAGHDAD (ZONE: 27): 32 NEUT KILLED, 78 NEUT WOUNDED (TBC",MND-BAGHDAD,FRIEND,0,0,0,1,78,32,0,0,0,33,33.38003922,44.39951706
14115,2/3/2004 10:04,Explosive Hazard,IED Explosion,EXPLOSIONS IN KARBALA: 113 NEU KILLED; 233 NEU INJ,MND-S,ENEMY,0,0,0,0,233,113,0,0,15,113,32.61661911,44.39951706
14112,2/3/2004 10:20,Explosive Hazard,IED Explosion,"IED ATTK ON 1-37AR IVO BAGHDAD (ZONE 22): 1 X CF KIA, 1 X CF WIA",MND-BAGHDAD,ENEMY,1,1,0,0,0,0,0,0,0,1,33.3924408,44.39951706
14139,2/3/2004 13:34,Enemy Action,Direct Fire,SAF ATTK ON 5-20IN IVO HAMMAM AL ALLIL: 1 EKIA,MND-N,ENEMY,0,0,0,0,0,0,0,1,0,1,36.18393326,44.39951706
14163,2/3/2004 14:00,Other,Other,ICDC NEGLIGENT DISCHARGE IN BAGHDAD (ZONE 16): 1 ICDC KILLED,MND-BAGHDAD,NEUTRAL,0,0,0,1,0,0,0,0,0,1,33.34246445,44.39951706
14190,3/3/2004 1:00,Enemy Action,Attack,"VEH ATTEMPTS TO RUN TCP IN BAGHDAD (ZONE 60): 1 CF WIA, 1 EKIA, 1 EWIA",MND-BAGHDAD,ENEMY,1,0,0,0,0,0,1,1,0,1,33.28725433,44.39951706
14193,3/3/2004 3:30,Friendly Action,Other,QRF FROM 1-4ADA RESPONDS TO 1ID CONTACT IN BAGHDAD (ZONE 60),MND-BAGHDAD,FRIEND,0,0,0,0,0,0,0,2,0,2,33.28091812,44.39951706
14211,3/3/2004 7:30,Enemy Action,Attack,ATTK ON TELECOM TOWER IVO BAGHDAD (ZONE 37N): 1 NEUT KILLED,MND-BAGHDAD,ENEMY,0,0,0,0,0,0,0,1,0,1,33.30331802,44.39951706
14314,4/3/2004 16:10,Enemy Action,Direct Fire,SAF ATTK ON 2-3IN IN MOSUL: 3 EKIA; 3 NEU INJ,MND-N,ENEMY,0,0,0,0,3,0,0,3,0,3,36.35094452,44.39951706
14317,4/3/2004 21:00,Enemy Action,Direct Fire,RPG ATTK ON 1-13AR IVO AL FALLUJAH: 1 EKIA,MND-BAGHDAD,ENEMY,0,0,0,0,0,0,0,1,0,1,33.4178009,44.39951706
14356,4/3/2004 21:00,Enemy Action,Direct Fire,"SAF ATTK ON IPS IVO KIRKUK: 1 ISF KIA, 2 ISF WIA",MND-N,ENEMY,0,0,2,1,0,0,0,0,0,1,35.39928818,44.39951706
14333,4/3/2004 22:35,Enemy Action,Direct Fire,SAF AND RPG ATTK ON 2BCT USSF IN BAQUBAH: 1 NEUT KILLED,MND-N,ENEMY,0,0,0,0,0,1,0,0,0,1,33.78702545,44.39951706
14349,4/3/2004 23:49,Criminal Event,Murder,IPS OFFICER FOUND DEAD IVO BASRAH: 1 ISF DEAD,MND-SE,ENEMY,0,0,0,1,0,0,0,0,0,1,30.36413956,44.39951706
EC461609-8EF0-4ED8-90D3-9F80B2BB2F73,4/3/2004 23:49,Criminal Event,Murder,"26 Regt investigated an explosion, reported by 57 Bty, and subsequently found an IPS officer (off duty) who was shot 3 times in the head. The IPS officer was found 5 km SE of Az Zubyr. IPS were inform",MND-SE,ENEMY,0,0,0,1,0,0,0,0,0,1,30.36413956,44.39951706
